"","MonitoringLocationIdentifier","Avg","Max","LatestSample","totalSamples","X","Y","Name","description","timestamp","begin","end","altitudeMode","tessellate","extrude","visibility","drawOrder","icon","Organization_Formal_Name","Organization_Identifier","Monitoring_Location_Name","Monitoring_Location_Type_Name","Monitoring_Location_Description_Text","HUC_Eight_Digit_Code"
"105","USGS-455907086185401",287.75,1100,1978-08-09,4,-86.3151449,45.985249,"INDIAN LAKE NR. MANISTIQUE, SITE 1, MI",NA,NA,NA,NA,NA,-1,-1,-1,NA,NA,"USGS Michigan Water Science Center","USGS-MI","INDIAN LAKE NR. MANISTIQUE, SITE 1, MI","Lake, Reservoir, Impoundment","",4060106
"106","USGS-463145086270501",10,10,1979-08-30,1,-86.4515537,46.5291191,"CHAPEL L NR MELSTRAND MI",NA,NA,NA,NA,NA,-1,-1,-1,NA,NA,"USGS Michigan Water Science Center","USGS-MI","CHAPEL L NR MELSTRAND MI","Lake, Reservoir, Impoundment","",4020201
"107","USGS-463400086202001",12.5,20,1981-10-20,2,-86.339054,46.566625,"BEAVER L NR MELSTRAND MI",NA,NA,NA,NA,NA,-1,-1,-1,NA,NA,"USGS Michigan Water Science Center","USGS-MI","BEAVER L NR MELSTRAND MI","Lake, Reservoir, Impoundment","",4020201
"108","USGS-463503086132501",5,6,1981-10-20,2,-86.2237762,46.5841315,"KINGSTON L NR GRAND MARAIS MI",NA,NA,NA,NA,NA,-1,-1,-1,NA,NA,"USGS Michigan Water Science Center","USGS-MI","KINGSTON L NR GRAND MARAIS MI","Lake, Reservoir, Impoundment","",4020201
"109","USGS-463813086023001",4.5,6,1980-05-08,2,-86.0418313,46.6369202,"GRAND SABLE L NR GRAND MARAIS MI",NA,NA,NA,NA,NA,-1,-1,-1,NA,NA,"USGS Michigan Water Science Center","USGS-MI","GRAND SABLE L NR GRAND MARAIS MI","Lake, Reservoir, Impoundment","",4020201
"110","USGS-464912088285401",33,33,1991-08-21,1,-88.4817959,46.8199315,"ASSININS WETLAND (POND 3) AT ASSININS, MI",NA,NA,NA,NA,NA,-1,-1,-1,NA,NA,"USGS Michigan Water Science Center","USGS-MI","ASSININS WETLAND (POND 3) AT ASSININS, MI","Lake, Reservoir, Impoundment","",4020105
